Source,Folio,Seq,Incipit,Text,Feast,Occasion,Genre,Position,"Cantus ID",Mode,Diff,"Diff db"
"E-SAu Ms 2637",061v,004,Contristatus*,Contristatus*,"Quadrag., hebd. 4, fer. 3",MI,InV,,g00785c,5,,
"E-SAu Ms 2637",062r,001,"Exsurge domine fer opem nobis et","Exsurge domine fer opem nobis et libera nos propter nomen tuum","Quadrag., hebd. 4, fer. 3",MI,Gr,,g00786,3,,
"E-SAu Ms 2637",062r,002,"Deus auribus nostris audivimus patres nostri","Deus auribus nostris audivimus patres nostri annuntiaverunt nobis opus quod operatus es in diebus eorum in diebus antiquis","Quadrag., hebd. 4, fer. 3",MI,GrV,,g00786a,4,,
"E-SAu Ms 2637",062v,001,"Exspectans exspectavi dominum et respexit me","Exspectans exspectavi dominum et respexit me et exaudivit deprecationem meam et immisit in os meum canticum novum hymnum deo nostro","Quadrag., hebd. 4, fer. 3",MI,Of,,g01210,5,,
"E-SAu Ms 2637",062v,002,"Statuit supra petram pedes meos et","Statuit supra petram pedes meos et direxit gressus meos","Quadrag., hebd. 3, fer. 3",MI,OfV,,g01210a,5,,
"E-SAu Ms 2637",062v,003,"Multa fecisti tu domine deus meus","Multa fecisti tu domine deus meus mirabilia tua et cogitationibus tuis non est quis similis tibi bene nuntiavi justitiam tuam in ecclesia magna","Quadrag., hebd. 4, fer. 3",MI,OfV,,g01210b,5,,
"E-SAu Ms 2637",062v,004,"Domine deus tu cognovisti justitiam meam","Domine deus tu cognovisti justitiam meam non abscondi in corde meo veritatem tuam et salutare tuum dixi adjutor meus domine et protector meus","Quadrag., hebd. 4, fer. 3",MI,OfV,,g01210c,5,,
"E-SAu Ms 2637",062v,005,"Laetabimur in salutari tuo et in","Laetabimur in salutari tuo et in nomine domini dei nostri magnificabimur","Quadrag., hebd. 4, fer. 3",MI,Cm,,g00788,2,,
"E-SAu Ms 2637",062v,006,"Dum sanctificatus fuero in vobis congregabo","Dum sanctificatus fuero in vobis congregabo vos de universis terris et effundam super vos aquam mundam et mundabimini ab omnibus inquinamentis vestris et dabo vobis spiritum novum","Quadrag., hebd. 4, fer. 4",MI,In,,g00789,3,,
"E-SAu Ms 2637",063r,001,"Benedicam dominum *","Benedicam dominum *","Quadrag., hebd. 4, fer. 4",MI,InV,,g00789c,3,,
"E-SAu Ms 2637",063r,002,"Venite filii audite me timorem domini","Venite filii audite me timorem domini docebo vos","Quadrag., hebd. 4, fer. 4",MI,Gr,,g01162,5,,
"E-SAu Ms 2637",063r,003,"Accedite ad eum et illuminamini et","Accedite ad eum et illuminamini et facies vestrae non confundentur","Quadrag., hebd. 4, fer. 4",MI,GrV,,g01162a,5,,
"E-SAu Ms 2637",063r,004,"Beata gens cujus est dominus deus","Beata gens cujus est dominus deus eorum populus quem elegit dominus in hereditatem sibi","Quadrag., hebd. 4, fer. 4",,Gr,,g01217,1,,
"E-SAu Ms 2637",063r,005,"Verbo domini caeli firmati sunt et","Verbo domini caeli firmati sunt et spiritu oris ejus omnis virtus eorum","Quadrag., hebd. 4, fer. 4",MI,GrV,,g01217a,1,,
"E-SAu Ms 2637",064r,001,"Benedicite gentes dominum deum nostrum et","Benedicite gentes dominum deum nostrum et obaudite vocem laudis ejus qui posuit animam meam ad vitam et non dedit commoveri pedes meos benedictus dominus qui non amovit deprecationem meam et misericordiam suam a me alleluia","Quadrag., hebd. 4, fer. 4",MI,Of,,g01070,2,,
"E-SAu Ms 2637",064r,002,"Jubilate deo omnis terra psalmum dicite","Jubilate deo omnis terra psalmum dicite nomini ejus date gloriam laudi ejus","Quadrag., hebd. 4, fer. 4",MI,OfV,,g01070a,2,,
"E-SAu Ms 2637",064r,003,"In multitudine virtutis tuae mentientur tibi","In multitudine virtutis tuae mentientur tibi inimici tui omnis terra adoret te et psallat tibi altissime","Quadrag., hebd. 4, fer. 4",MI,OfV,,g01070b,2,,
"E-SAu Ms 2637",064r,004,"Venite et videte opera domini quam","Venite et videte opera domini quam terribilis in consiliis super filios hominum ad ipsum ore meo clamavi et exultavi sub lingua mea propterea exaudivit me Deus et attendit voci orationis meae","Quadrag., hebd. 4, fer. 4",MI,OfV,,g01070c,2,,
"E-SAu Ms 2637",064r,005,"Lutum fecit ex sputo dominus et","Lutum fecit ex sputo dominus et linivit oculos meos et abii et lavi et vidi et credidi deo","Quadrag., hebd. 4, fer. 4",MI,Cm,,g00790,1,,
"E-SAu Ms 2637",064v,001,"Laetetur cor quaerentium dominum quaerite dominum","Laetetur cor quaerentium dominum quaerite dominum et confirmamini quaerite faciem ejus semper","Quadrag., hebd. 4, fer. 5",MI,In,,g00791,2,,
"E-SAu Ms 2637",064v,002,"Confitemini domino et invocate *","Confitemini domino et invocate *","Quadrag., hebd. 4, fer. 5",MI,InV,,g00791a,2,,
"E-SAu Ms 2637",065r,001,"Respice domine in testamentum tuum et","Respice domine in testamentum tuum et animas pauperum tuorum ne obliviscaris in finem","Quadrag., hebd. 4, fer. 5",MI,Gr,,g01195,5,,
"E-SAu Ms 2637",065r,002,"Exsurge domine et judica causam tuam","Exsurge domine et judica causam tuam memor esto opprobrii servorum tuorum","Quadrag., hebd. 4, fer. 5",MI,GrV,,g01195a,5,,
"E-SAu Ms 2637",065r,003,"Domine in auxilium meum *","Domine in auxilium meum *","Quadrag., hebd. 4, fer. 5",MI,Of,,g02305,*,,
"E-SAu Ms 2637",065r,004,"Domine memorabor justitiae tuae solius deus","Domine memorabor justitiae tuae solius deus docuisti me a juventute mea et usque in senectam et senium deus ne derelinquas me","Quadrag., hebd. 4, fer. 5",MI,Cm,,g01215,8,,
"E-SAu Ms 2637",065v,001,"Meditatio cordis mei in conspectu tuo","Meditatio cordis mei in conspectu tuo semper domine adjutor meus et redemptor meus","Quadrag., hebd. 4, fer. 6",MI,In,,g00793,1,,
"E-SAu Ms 2637",065v,002,"Caeli enarrant *","Caeli enarrant *","Quadrag., hebd. 4, fer. 6",MI,InV,,g00793b,1,,
"E-SAu Ms 2637",065v,003,"Bonum est confidere in domino quam","Bonum est confidere in domino quam confidere in homine","Quadrag., hebd. 4, fer. 6",MI,Gr,,g01201,5,,
"E-SAu Ms 2637",065v,004,"Bonum est sperare in domino quam","Bonum est sperare in domino quam sperare in principibus","Quadrag., hebd. 4, fer. 6",MI,GrV,,g01201a,5,,
"E-SAu Ms 2637",066v,001,"Populum humilem salvum facies domine et","Populum humilem salvum facies domine et oculos superborum humiliabis quoniam quis deus praeter te domine","Quadrag., hebd. 4, fer. 6",MI,Of,,g01171,5,,
"E-SAu Ms 2637",066v,002,"Clamor meus in conspectu ejus introivit","Clamor meus in conspectu ejus introivit in aures ejus","Quadrag., hebd. 4, fer. 6",MI,OfV,,g01171a,5,,
"E-SAu Ms 2637",066v,003,"Liberator meus de gentibus iracundis ab","Liberator meus de gentibus iracundis ab insurgentibus in me exaltabis me","Quadrag., hebd. 4, fer. 6",MI,OfV,,g01171b,5,,
"E-SAu Ms 2637",066v,004,"Videns dominus flentes sorores Lazari ad","Videns dominus flentes sorores Lazari ad monumentum lacrimatus est coram judaeis et clamabat Lazare veni foras et prodiit ligatis manibus et pedibus qui fuerat quatriduanus mortuus","Quadrag., hebd. 4, fer. 6",MI,Cm,,g00794,1,,
"E-SAu Ms 2637",066v,005,"Sitientes venite ad aquas dicit dominus","Sitientes venite ad aquas dicit dominus et qui non habetis pretium venite bibite cum laetitia","Quadrag., hebd. 4, sabbato",MI,In,,g00795,2,,
"E-SAu Ms 2637",067r,001,"Attendite *","Attendite *","Quadrag., hebd. 4, sabbato",MI,InV,,g00795b,2,,
"E-SAu Ms 2637",067r,002,"Tibi domine derelictus est pauper pupillo","Tibi domine derelictus est pauper pupillo tu eris adjutor","Quadrag., hebd. 4, sabbato",,Gr,,g00796,3,,
"E-SAu Ms 2637",067r,003,"Ut quid domine recessisti longe despicis","Ut quid domine recessisti longe despicis in opportunitatibus in tribulatione dum superbit impius incenditur pauper","Quadrag., hebd. 4, sabbato",MI,GrV,,g00796a,3,,
"E-SAu Ms 2637",067v,001,"Factus est dominus firmamentum meum et","Factus est dominus firmamentum meum et refugium meum et liberator meus sperabo in eum","Quadrag., hebd. 4, sabbato",MI,Of,,g00798,4,,
"E-SAu Ms 2637",067v,002,"Persequar inimicos meos et comprehendam illos","Persequar inimicos meos et comprehendam illos et non convertar donec deficiant","Quadrag., hebd. 4, sabbato",MI,OfV,,g00798a,4,,
"E-SAu Ms 2637",067v,003,"Praecinxisti me virtute ad bellum et","Praecinxisti me virtute ad bellum et subplantasti inimicos meos subtus me et inimicorum meorum dedisti mihi dorsum et odientes me disperdidisti","Quadrag., hebd. 4, sabbato",MI,OfV,,g00798b,4,,
"E-SAu Ms 2637",067v,004,"Dominus regit me et nihil mihi","Dominus regit me et nihil mihi deerit in loco pascuae ibi me collocavit super aquam refectionis educavit me","Quadrag., hebd. 4, sabbato",MI,Cm,,g00799,2,,
"E-SAu Ms 2637",067v,005,"Judica me deus et discerne causam","Judica me deus et discerne causam meam de gente non sancta ab homine iniquo et doloso eripe me quia tu es deus meus et fortitudo mea","Dom. de passione",MI,In,,g00800,4,,
"E-SAu Ms 2637",067v,006,"Emitte lucem tuam *","Emitte lucem tuam *","Dom. de passione",MI,InV,,g00800c,4,,
"E-SAu Ms 2637",068r,001,"Eripe me domine de inimicis meis","Eripe me domine de inimicis meis doce me facere voluntatem tuam","Dom. de passione",MI,Gr,,g00801,3,,
"E-SAu Ms 2637",068r,002,"Liberator meus domine de gentibus iracundis","Liberator meus domine de gentibus iracundis ab insurgentibus in me exaltabis me a viro iniquo eripies me","Dom. de passione",MI,GrV,,g00801a,3,,
"E-SAu Ms 2637",068r,003,"Saepe expugnaverunt me a juventute mea","Saepe expugnaverunt me a juventute mea","Dom. de passione",MI,Tc,,g00803,8,,
"E-SAu Ms 2637",068r,004,"Dicat nunc Israel saepe expugnaverunt me","Dicat nunc Israel saepe expugnaverunt me a juventute mea","Dom. de passione",MI,TcV,,g00803a,8,,
"E-SAu Ms 2637",068r,005,"Etenim non potuerunt mihi supra dorsum","Etenim non potuerunt mihi supra dorsum meum fabricaverunt peccatores","Dom. de passione",MI,TcV,,g00803b,8,,
"E-SAu Ms 2637",068r,006,"Prolongaverunt iniquitatem sibi dominus justus concidet","Prolongaverunt iniquitatem sibi dominus justus concidet cervices peccatorum","Dom. de passione",MI,TcV,,g00803c,8,,
"E-SAu Ms 2637",068v,001,"Confitebor tibi domine in toto corde","Confitebor tibi domine in toto corde meo retribue servo tuo vivam et custodiam sermones tuos vivifica me secundum verbum tuum domine","Dom. de passione",MI,Of,,g00807,1,,
"E-SAu Ms 2637",068v,002,"Beati immaculati in via qui ambulant","Beati immaculati in via qui ambulant in lege Domini beati qui scrutantur testimonia ejus in toto corde exquirunt eum","Dom. de passione",MI,OfV,,g00807a,1,,
"E-SAu Ms 2637",068v,003,"Viam veritatis elegi da mihi intellectum","Viam veritatis elegi da mihi intellectum et scrutabor legem tuam et custodiam illam in toto corde meo","Dom. de passione",MI,OfV,,g00807b,1,,
"E-SAu Ms 2637",068v,004,"Inclina cor meum in testimonia tua","Inclina cor meum in testimonia tua et non in avaritia in via tua vivifica me judicia enim tua jucunda","Dom. de passione",MI,OfV,,g00807c,1,,
"E-SAu Ms 2637",068v,005,"Deprecatus sum vultum tuum in toto","Deprecatus sum vultum tuum in toto corde meo quia dilexi legem tuam","Dom. de passione",MI,OfV,,g00807d,1,,
"E-SAu Ms 2637",068v,006,"Hoc corpus quod pro vobis tradetur","Hoc corpus quod pro vobis tradetur hic calix novi testamenti est in meo sanguine dicit Dominus hoc facite quotiescumque sumitis in meam commemorationem","Dom. de passione",MI,Cm,,g00808,8,,
"E-SAu Ms 2637",068v,007,"Miserere mihi domine quoniam conculcavit me","Miserere mihi domine quoniam conculcavit me homo tota die bellans tribulavit me","Fer. 2 de Passione",MI,In,,g00809,3,,
"E-SAu Ms 2637",069r,001,"Conculcaverunt me *","Conculcaverunt me *","Fer. 2 de Passione",MI,InV,,g00809c,3,,
"E-SAu Ms 2637",069r,002,"Deus exaudi orationem meam auribus percipe","Deus exaudi orationem meam auribus percipe verba oris mei","Fer. 2 de Passione",MI,Gr,,g00810,8,,
"E-SAu Ms 2637",069r,003,"Deus in nomine tuo salvum me","Deus in nomine tuo salvum me fac et in virtute tua judica me","Fer. 2 de Passione",MI,GrV,,g00810a,8,,
"E-SAu Ms 2637",069v,001,"Domine convertere et eripe animam meam","Domine convertere et eripe animam meam salvum me fac propter misericordiam tuam","Fer. 2 de Passione",MI,Of,,g01137,6,,
"E-SAu Ms 2637",069v,002,"Domine ne in ira tua arguas","Domine ne in ira tua arguas me neque in furore tuo corripias me","Fer. 2 de Passione",MI,OfV,,g01137a,6,,
"E-SAu Ms 2637",069v,003,"Miserere mihi Domine quoniam infirmus sum","Miserere mihi Domine quoniam infirmus sum sana me Domine quoniam conturbata sunt omnia ossa mea","Fer. 2 de Passione",MI,OfV,,g01137b,6,,
"E-SAu Ms 2637",069v,004,"Dominus virtutum ipse est rex gloriae","Dominus virtutum ipse est rex gloriae","Fer. 2 de Passione",MI,Cm,,g00812,3,,
"E-SAu Ms 2637",069v,005,"Exspecta dominum viriliter age et confortetur","Exspecta dominum viriliter age et confortetur cor tuum et sustine dominum","Fer. 3 de Passione",MI,In,,g00813,7,,
"E-SAu Ms 2637",069v,006,"Dominus illuminatio *","Dominus illuminatio *","Fer. 3 de Passione",MI,InV,,g00813a,7,,
"E-SAu Ms 2637",070r,001,"Discerne causam meam domine ab homine","Discerne causam meam domine ab homine iniquo et doloso eripe me","Fer. 3 de Passione",MI,Gr,,g00814,5,,
"E-SAu Ms 2637",070r,002,"Emitte lucem tuam et veritatem tuam","Emitte lucem tuam et veritatem tuam ipsa me deduxerunt et adduxerunt in montem sanctum tuum","Fer. 3 de Passione",MI,GrV,,g00814a,5,,
"E-SAu Ms 2637",070v,001,"Sperent in te omnes qui noverunt","Sperent in te omnes qui noverunt nomen tuum domine quoniam non derelinquis quaerentes te psallite domino qui habitat in Sion quoniam non est oblitus orationem pauperum","Fer. 3 de Passione",MI,Of,,g01149,3,,
"E-SAu Ms 2637",070v,002,"Sedes super thronum qui judicas aequitatem","Sedes super thronum qui judicas aequitatem increpasti gentes et periit impius judicare populum cum justitia et factus es refugium pauperum","Fer. 3 de Passione",MI,OfV,,g01149a,3,,
"E-SAu Ms 2637",070v,003,"Cognoscetur Dominus judicia faciens quoniam patientia","Cognoscetur Dominus judicia faciens quoniam patientia pauperum non peribit in finem desiderium pauperum exaudivit Deus","Fer. 3 de Passione",MI,OfV,,g01149b,3,,
"E-SAu Ms 2637",070v,004,"Redime me deus Israel ex omnibus","Redime me deus Israel ex omnibus angustiis meis","Fer. 3 de Passione",MI,Cm,,g00816,7,,
"E-SAu Ms 2637",070v,005,"Liberator meus de gentibus iracundis ab","Liberator meus de gentibus iracundis ab insurgentibus in me exaltabis me a viro iniquo eripies me domine","Fer. 4 de Passione",MI,In,,g00817,3,,
"E-SAu Ms 2637",070v,006,"Diligam te Domine *","Diligam te Domine *","Fer. 4 de Passione",MI,InV,,g00817c,3,,
"E-SAu Ms 2637",071r,001,"Exaltabo te domine quoniam suscepisti me","Exaltabo te domine quoniam suscepisti me nec delectasti inimicos meos super me","Fer. 4 de Passione",MI,Gr,,g00818,3,,
"E-SAu Ms 2637",071r,002,"Domine deus meus clamavi ad te","Domine deus meus clamavi ad te et sanasti me domine abstraxisti ab inferis animam meam salvasti me a descendentibus in lacum","Fer. 4 de Passione",MI,GrV,,g00818a,3,,
"E-SAu Ms 2637",071r,003,"Eripe me de inimicis meis deus","Eripe me de inimicis meis deus meus et ab insurgentibus in me libera me domine","Fer. 4 de Passione",MI,Of,,g00820,7,,
"E-SAu Ms 2637",071v,001,"Quia factus es adjutor meus et","Quia factus es adjutor meus et refugium meum in die tribulationis meae","Fer. 4 de Passione",MI,OfV,,g00820a,7,,
"E-SAu Ms 2637",071v,002,"Quia ecce captaverunt animam meam et","Quia ecce captaverunt animam meam et irruerunt fortes in me","Fer. 4 de Passione",MI,OfV,,g00820b,7,,
"E-SAu Ms 2637",071v,003,"Lavabo inter innocentes manus meas et","Lavabo inter innocentes manus meas et circuibo altare tuum domine ut audiam vocem laudis tuae et enarrem universa mirabilia tua","Fer. 4 de Passione",MI,Cm,,g00821,8,,
"E-SAu Ms 2637",071v,004,"Omnia quae fecisti nobis domine in","Omnia quae fecisti nobis domine in vero judicio fecisti quia peccavimus tibi et mandatis tuis non obedivimus sed da gloriam nomini tuo et fac nobiscum secundum multitudinem misericordiae tuae","Fer. 5 de Passione",MI,In,,g01237,3,,
"E-SAu Ms 2637",071v,005,"Magnus Dominus *","Magnus Dominus *","Fer. 5 de Passione",MI,InV,,g01237a,3,,
"E-SAu Ms 2637",072r,001,"Tollite hostias et introite in atria","Tollite hostias et introite in atria ejus adorate Dominum in aula sancta ejus","Fer. 5 de Passione",MI,Gr,,g00822,5,,
"E-SAu Ms 2637",072r,002,"Revelabit dominus condensa et in templo","Revelabit dominus condensa et in templo ejus omnes dicent gloriam","Fer. 5 de Passione",MI,GrV,,g00822a,5,,
"E-SAu Ms 2637",072r,003,"Super flumina Babylonis illic sedimus et","Super flumina Babylonis illic sedimus et flevimus dum recordaremur tui Sion","Fer. 5 de Passione",MI,Of,,g01239,1,,
"E-SAu Ms 2637",072r,004,"In salicibus in medio ejus suspendimus","In salicibus in medio ejus suspendimus organa nostra quoniam illic interrogaverunt nos qui captivos duxerunt nos verba canticorum et qui abduxerunt nos hymnum cantate nobis de canticis Sion quomodo cantabimus canticum Domini in terra aliena","Fer. 5 de Passione",MI,OfV,,g01239a,1,,
"E-SAu Ms 2637",072v,001,"Si oblitus fuero tui Jerusalem obliviscatur","Si oblitus fuero tui Jerusalem obliviscatur me dextera mea adhaereat lingua mea faucibus meis si non meminero tui","Fer. 5 de Passione",MI,OfV,,g01239b,1,,
"E-SAu Ms 2637",072v,002,"Memento domine filiorum Edom in die","Memento domine filiorum Edom in die Jerusalem","Fer. 5 de Passione",MI,OfV,,g01239c,1,,
"E-SAu Ms 2637",072v,003,"Memento verbi tui servo tuo domine","Memento verbi tui servo tuo domine in quo mihi spem dedisti haec me consolata est in humilitate mea","Fer. 5 de Passione",MI,Cm,,g01240,4,,
"E-SAu Ms 2637",072v,004,"Miserere mihi domine quoniam tribulor libera","Miserere mihi domine quoniam tribulor libera me et eripe me de manibus inimicorum meorum et a persequentibus me domine non confundar quoniam invocavi te","Fer. 6 de Passione",MI,In,,g00824,5,,
"E-SAu Ms 2637",072v,005,"In te domine speravi *","In te domine speravi *","Fer. 6 de Passione",MI,InV,,g00824a,5,,
"E-SAu Ms 2637",073r,001,"Pacifice loquebantur mihi inimici mei et","Pacifice loquebantur mihi inimici mei et in ira molesti erant mihi","Fer. 6 de Passione",MI,Gr,,g00825,5,,
"E-SAu Ms 2637",073r,002,"Vidisti domine ne sileas ne discedas","Vidisti domine ne sileas ne discedas a me","Fer. 6 de Passione",MI,GrV,,g00825a,5,,
"E-SAu Ms 2637",073r,003,"Benedictus es domine doce me justificationes","Benedictus es domine doce me justificationes tuas et non tradas calumniantibus me superbis et respondebo exprobrantibus mihi verbum","Fer. 6 de Passione",MI,Of,,g00827,8,,
"E-SAu Ms 2637",073r,004,"Vidi non servantes pactum et tabescebam","Vidi non servantes pactum et tabescebam Domine quando facies de persequentibus me judicium","Fer. 6 de Passione",MI,OfV,,g00827a,8,,
"E-SAu Ms 2637",073r,005,"Appropinquaverunt persequentes me iniqui confundantur et","Appropinquaverunt persequentes me iniqui confundantur et reverantur quia injuste iniquitatem fecerunt in me","Fer. 6 de Passione",MI,OfV,,g00827b,8,,
"E-SAu Ms 2637",073r,006,"Ne tradideris me domine in animas","Ne tradideris me domine in animas persequentium me quia insurrexerunt in me testes iniqui et mentita est iniquitas sibi","Fer. 6 de Passione",MI,Cm,,g00828,7,,
"E-SAu Ms 2637",073v,001,"Miserere mihi Domine *","Miserere mihi Domine *","Sabb. de Passione",CA,In,,g00824,*,,
"E-SAu Ms 2637",073v,002,"Pacifice loquebantur *","Pacifice loquebantur *","Sabb. de Passione",MI,Gr,,g00825,*,,
"E-SAu Ms 2637",073v,003,"Vidisti Domine *","Vidisti Domine *","Sabb. de Passione",MI,GrV,,g00825a,*,,
"E-SAu Ms 2637",074r,001,"Benedictus es Domine *","Benedictus es Domine *","Sabb. de Passione",MI,Of,,g00827,*,,
"E-SAu Ms 2637",074r,002,"Ne tradideris *","Ne tradideris *","Sabb. de Passione",MI,Cm,,g00828,*,,
"E-SAu Ms 2637",074r,003,"Sitientes venite ad aquas *","Sitientes venite ad aquas *","Dom. in Palmis",MI,In,,g00795,*,,
"E-SAu Ms 2637",075v,001,"Haec est sacra prudens virgo","Haec est sacra prudens virgo",Marinae,,Sq,,g02833,,,
"E-SAu Ms 2637",076r,001,"Palmae fuerunt in manibus","Palmae fuerunt in manibus","Dom. in Palmis",X,A,P,a01383,,,
"E-SAu Ms 2637",076r,002,"Pueri Hebraeorum tollentes ramos olivarum obviaverunt","Pueri Hebraeorum tollentes ramos olivarum obviaverunt domino clamantes et dicentes hosanna in excelsis","Dom. in Palmis",X,A,,004415,1,,
"E-SAu Ms 2637",076r,003,"Pueri Hebraeorum vestimenta prosternebant in via","Pueri Hebraeorum vestimenta prosternebant in via et clamabant dicentes hosanna filio David benedictus qui venit in nomine domini","Dom. in Palmis",X,A,,004416,1,,
"E-SAu Ms 2637",076r,004,"Collegerunt pontifices et pharisaei concilium et","Collegerunt pontifices et pharisaei concilium et dicebant quid facimus quia hic homo multa signa facit si dimittimus eum sic omnes credent in eum ne forte veniant Romani et tollant nostrum locum et gentem","Dom. in Palmis",X,A,,001852,2,,
"E-SAu Ms 2637",076r,005,"Unus autem ex ipsis Caiphas nomine","Unus autem ex ipsis Caiphas nomine cum esset pontifex anni illius prophetavit dicens expedit vobis ut unus moriatur homo pro populo et non tota gens pereat ab illo ergo die cogitaverunt interficere eum dicentes","Dom. in Palmis",X,AV,,001852a,2,,
"E-SAu Ms 2637",076r,006,"Cum appropinquaret Dominus Jerosolimam misit duos","Cum appropinquaret Dominus Jerosolimam misit duos ex discipulis suis dicens ite in castellum quod est contra vos et invenietis pullum asinae alligatum super quem nullus hominum sedit solvite et adducite mihi si quis vobis interrogaverit dicite opus Domini est solventes adduxerunt ad Jesum et imposuerunt sibi vestimenta et sedit super eum alii ramos de arboribus externebant et qui sequebantur clamabant osanna benedictus qui venit in nomine Domini benedictum regnum patris nostri David hosanna in excelsis miserere nobis fili David","Dom. in Palmis",X,A,,001976,7,,
"E-SAu Ms 2637",076v,001,"Cum audisset populus quia Jesus venit","Cum audisset populus quia Jesus venit Jerosolimam acceperunt ramos palmarum et exierunt ei obviam et clamabant pariter dicentes hic est qui venturus est ad salutem gentium hic est salus nostra et redemptio Israel quantus est iste cui throni et dominationes occurrunt hic est rex Israel et Emmanuel genus David et mundi salvator noli timere filia Syon ecce rex tuus venit tibi sedens supra pullum asinae sicut scriptum est Salve rex fabricator mundi qui venisti redimere nos","Dom. in Palmis",X,A,,001983.1,7,,
"E-SAu Ms 2637",076v,002,"Ave Rex noster fili David redemptor","Ave Rex noster fili David redemptor mundi quem prophetae praedixerunt salvatorem domui Israel esse venturum te enim ad salutare victimam Pater misit in mundum quem exspectabant omnes sancti ab origine mundi et nunc hosanna filio David benedictus qui venit in nomine Domine hosanna in excelsis","Dom. in Palmis",X,A,,001543,1,,
"E-SAu Ms 2637",076v,003,"Ante sex dies sollemnis paschae quo","Ante sex dies sollemnis paschae quo venit dominus in civitatem Jerusalem occurrerunt ei pueri et in manibus portabant ramos palmarum et clamabant voce magna dicentes hosanna in excelsis benedictus qui venit in multitudine misericordiae suae hosanna in excelsis","Dom. in Palmis",X,A,,001437,,,
"E-SAu Ms 2637",076v,004,"Occurrunt turbae cum foliis palmae redemptori","Occurrunt turbae cum foliis palmae redemptori obviam et victori triumphanti digna dant obsequia filium dei ore gentes praedicant et in laude Christi voces tonant per nubila hosanna","Dom. in Palmis",X,A,,004107,8,,
"E-SAu Ms 2637",077r,001,"Multa turba judaeorum injecerunt manus in","Multa turba judaeorum injecerunt manus in salvatorem ille ut agnus innocens non negavit passionem Pilatus dicebat ego nullam causam mortis invenio in eo populus judaeorum clamabat crucifigatur","Dom. in Palmis",X,A,,003830,3,,
"E-SAu Ms 2637",077r,002,"Coeperunt omnes turbae descendentium gaudentes laudare","Coeperunt omnes turbae descendentium gaudentes laudare Deum voce magna super omnibus quas viderant virtutibus dicentes benedictus qui venit rex in nomine Domini pax in caelo et gloria in excelsis","Dom. in Palmis",X,A,,001840,1,,
"E-SAu Ms 2637",077r,003,"Prima autem die azymorum accesserunt discipuli","Prima autem die azymorum accesserunt discipuli ad Jesum dicentes ubi vis paremus tibi comedere pascha at Jesus dixit eis ite in civitatem ad quendam et dicite ei magister dixit tempus meum prope est apud te facio pascha cum discipulis meis et fecerunt discipuli sicut praeceperat eis Dominus et paraverunt pascha","Dom. in Palmis",X,A,,203956.1,8,,
"E-SAu Ms 2637",077r,004,"Gloria laus et honor tibi sit","Gloria laus et honor tibi sit Rex Christe Redemptor Cui puerile decus prompsit Hosanna pium Israel es tu Rex Davidis et inclita proles Nomine qui in Domini Rex benedicte venis Coetus in excelsis te laudat caelicus omnis Et mortalis homo et cuncta creata simul Plebs Hebrae tibi cum palmis obvia venit Cum prece voto hymnis adsumus ecce tibi Hi tibi passuro solvebant munia laudis Nos tibi regnanti pangimus ecce melos Hi placuere tibi placeat devotio nostra Rex bone Rex clemens cui bona cuncta placent","Dom. in Palmis",,H,,008310,1,,
"E-SAu Ms 2637",077v,001,"Ingrediente domino *","Ingrediente domino *","Dom. in Palmis",X,R,,006961,*,,
"E-SAu Ms 2637",077v,002,"Domine ne longe facias auxilium tuum","Domine ne longe facias auxilium tuum a me ad defensionem meam aspice libera me de ore leonis et a cornibus unicornuorum humilitatem meam","Dom. in Palmis",MI,In,,g00845,8,,
"E-SAu Ms 2637",077v,003,"Deus deus meus *","Deus deus meus *","Dom. in Palmis",MI,InV,,g00845c,8,,
"E-SAu Ms 2637",077v,004,"Tenuisti manum dexteram meam in voluntate","Tenuisti manum dexteram meam in voluntate tua deduxisti me et cum gloria assumpsisti me","Dom. in Palmis",MI,Gr,,g00846,4,,
"E-SAu Ms 2637",077v,005,"Quam bonus Israel deus rectis corde","Quam bonus Israel deus rectis corde mei autem pene moti sunt pedes pene effusi sunt gressus mei quia zelavi in peccatoribus pacem peccatorum videns","Dom. in Palmis",MI,GrV,,g00846a,4,,
"E-SAu Ms 2637",078r,001,"Deus deus meus respice in me","Deus deus meus respice in me quare me dereliquisti","Dom. in Palmis",MI,Tc,,g00848,2,,
"E-SAu Ms 2637",078r,002,"Longe a salute mea verba delictorum","Longe a salute mea verba delictorum meorum","Dom. in Palmis",MI,TcV,,g00848a,2,,
