Source,Folio,Seq,Incipit,Text,Feast,Occasion,Genre,Position,"Cantus ID",Mode,Diff,"Diff db"
"E-SAu Ms 2637",131v,001,"Alleluia Dum complerentur*","Alleluia Dum complerentur*","Pent., sabbato Q.T.",MI,Al,,g01112.1,,,
"E-SAu Ms 2637",131v,002,"Alleluia Repleti sunt*","Alleluia Repleti sunt*","Pent., sabbato Q.T.",MI,Al,,g02585,,,
"E-SAu Ms 2637",131v,003,"Alleluia Benedictus es domine deus*","Alleluia Benedictus es domine deus*","Pent., sabbato Q.T.",MI,Al,,g01113,,,
"E-SAu Ms 2637",132r,001,"Alleluia Veni sancte*","Alleluia Veni sancte*","Pent., sabbato Q.T.",MI,Al,,g01092,,,
"E-SAu Ms 2637",132r,002,"Laudate dominum*","Laudate dominum*","Pent., sabbato Q.T.",MI,Tc,,g00715,,,
"E-SAu Ms 2637",132r,003,"Domine deus salutis*","Domine deus salutis*","Pent., sabbato Q.T.",MI,Of,,g00717,,,
"E-SAu Ms 2637",132r,004,"Non vos relinquam*","Non vos relinquam*","Pent., sabbato Q.T.",MI,Cm,,g01108,,,
"E-SAu Ms 2637",132r,005,"Benedicta sit sancta trinitas atque indivisa","Benedicta sit sancta trinitas atque indivisa unitas confitebimur ei quia fecit nobiscum misericordiam suam","Sanctissimae Trinitatis",MI,In,,g01116,8,,
"E-SAu Ms 2637",132r,006,"Benedicamus patrem*","Benedicamus patrem*","Pent., sabbato",MI,InV,,g01116a,8,,
"E-SAu Ms 2637",132v,001,"Benedictus es domine qui intueris abyssos","Benedictus es domine qui intueris abyssos et sedes super cherubim","Sanctissimae Trinitatis",MI,Gr,,g01117,5,,
"E-SAu Ms 2637",132v,002,"Benedicite deum caeli quia fecit nobiscum","Benedicite deum caeli quia fecit nobiscum misericordiam suam","Sanctissimae Trinitatis",MI,GrV,,g01117a,5,,
"E-SAu Ms 2637",132v,003,"Alleluia Benedictus es domine deus patrum","Alleluia Benedictus es domine deus patrum nostrorum et laudabilis in saecula","Sanctissimae Trinitatis",MI,Al,,g01113,8,,
"E-SAu Ms 2637",132v,004,"Alleluia Qualis pater talis filius talis","Alleluia Qualis pater talis filius talis et spiritus sanctus","Sanctissimae Trinitatis",MI,Al,,g02183,7,,
"E-SAu Ms 2637",133r,001,"Benedictus sit deus pater unigenitusque dei","Benedictus sit deus pater unigenitusque dei filius sanctus quoque spiritus quia fecit nobis cum misericordiam suam","Sanctissimae Trinitatis",MI,Of,,g01120,3,,
"E-SAu Ms 2637",133r,002,"Benedictus es qui intueris abyssos et","Benedictus es qui intueris abyssos et sedes super cherubim et super laudabilis et super exaltatus in saecula","Sanctissimae Trinitatis",MI,OfV,,g01120d,3,,
"E-SAu Ms 2637",133r,003,"Benedicamus patrem et filium cum sancto","Benedicamus patrem et filium cum sancto spiritu laudemus et superexaltemus eum in saecula","Sanctissimae Trinitatis",MI,OfV,,g01120b,3,,
"E-SAu Ms 2637",133r,004,"Benedicimus deum caeli et coram omnibus","Benedicimus deum caeli et coram omnibus viventibus confitebimur ei quia fecit nobiscum misericordiam suam","Sanctissimae Trinitatis",MI,Cm,,g01121,4,,
"E-SAu Ms 2637",133r-133v,005,"Omnipotens deus supplices te rogamus et","Omnipotens deus supplices te rogamus et petimus ut intercessio archangelorum sit pro nobis ad te semper Michaelis et Gabrielis pariterque et Raphaelis ut digni offeramus tibi hostias ad altare et appareamus ante salvatorem per intercessionem novem ordinum angelorum thronum et dominationum principatum et potestatum et virtutum cum cherubim et seraphim ut ipsi intercedant pro nobis qui non cessant clamare voce sanctus sanctus sanctus dominus deus exercituum rex Israel qui regnas sine fine dignare famulos tuos hodie exaudire alleluia","Ad Processionem",X,A,P,004143.2,,,
"E-SAu Ms 2637",133v,001,"Oremus dilectissimi nobis deum patrem omnipotentem","Oremus dilectissimi nobis deum patrem omnipotentem ut cunctis mundum purget erroribus morbos auferat famem depellat aperiat carceres vincla dissolvat peregrinantibus reditum infirmantibus sanitatem navigantibus portum salutis indulgeat et pacem tribuat in diebus nostris insurgentesque repellat inimicos et de manu inferni liberet nos propter nomen suum [amen]","Ad Processionem",X,A,P,004190,3,,
"E-SAu Ms 2637",133v,002,"Asperges me domine hyssopo et mundabor","Asperges me domine hyssopo et mundabor lavabis me et super nivem dealbabor","Ad Processionem",X,A,P,001494,7,,
"E-SAu Ms 2637",133v,003,"Signum salutis pone domine in domibus","Signum salutis pone domine in domibus istis ut non permittas introire angelum percucientem in domibus in quibus habitamus de caelo pone signum tuum domine et protege nos et non erit in nobis plaga nocens","Ad Processionem",X,A,P,206526.1,2,,
"E-SAu Ms 2637",133v-134r,004,"Oportet nos mundum contemnere ut possimus","Oportet nos mundum contemnere ut possimus sequi Christum dominum ne perdamus vitam perpetuam propter vanam hujus mundi gloriam te laudamus domine omnipotens qui sedes super cherubim propitius exaudi nos te laudant angeli et archangeli te venerantur prophetae et apostoli te adoramus te deprecamur mundi redemptor quem pater misit ovibus pastorem alleluia alleluia","Ad Processionem",X,A,P,004164.1,7,,
"E-SAu Ms 2637",134r,001,"Salvator mundi salva nos omnes sancta","Salvator mundi salva nos omnes sancta dei genetrix virgo semper Maria ora pro nobis precibus quoque sanctorum angelorum archangelorum patriarcharum ac prophetarum apostolorum evangelistarum et martyrum confessorum et virginum et omnium sanctorum suppliciter petimus ut a malis omnibus eruamur bonisque omnibus nunc et semper perfrui mereamur","Ad Processionem",X,A,P,004689.1,1,,
"E-SAu Ms 2637",134r,002,"Asperges me domine hyssopo et mundabor","Asperges me domine hyssopo et mundabor lavabis me et super nivem dealbabor","Ad Processionem",X,A,P,001494,4,,
"E-SAu Ms 2637",134r,003,"Pax huic domui et omnibus habitantibus","Pax huic domui et omnibus habitantibus in ea pax egredientibus et regredientibus alleluia","Ad Processionem",X,A,P,203797.1,,,
"E-SAu Ms 2637",134r,004,"Pax aeterna ab aeterno patre huic","Pax aeterna ab aeterno patre huic domui pax perennis verbum patris sit pax huic domui pacem pius consolator huic praestet dominus","Ad Processionem",X,A,P,004252,1,,
"E-SAu Ms 2637",134r-134v,005,"Ego sapientia habito in consiliis et","Ego sapientia habito in consiliis et eruditis intersum cogitationibus dominus possedit me in initio viarum suarum antequam quicquam faceret a principio ab aeterno ordinata sum antequam terram faceret necdum erant abyssi et ego jam concepta eram nondum fontes aquarum eruperant necdum montes gravi mole constiterant adhuc terram non fecerat et flumina et cardines orbis terrae quando praeparabat caelos aderam quando appendebat fundamenta terrae cum eo eram cuncta componens et delectabar per singulos dies laudens coram eo Beatus qui audit me qui vigilat ad fontes meos cottidie qui me invenerit inveniet vitam et hauriet salutem a domino","Ad Processionem",X,A,P,a01074,1,,
"E-SAu Ms 2637",134v,001,"Gregem tuum domine ne deseras pastor","Gregem tuum domine ne deseras pastor bone qui dormire nescis sed semper vigilas","Ad Processionem",X,A,P,002980,3?,,
"E-SAu Ms 2637",134v,002,"Domine in tua misericordia speravi exsultavit","Domine in tua misericordia speravi exsultavit cor meum in salutari tuo cantabo domino qui bona tribuit mihi","Dom. 1 p. Pent.",MI,In,,g01122,5,,
"E-SAu Ms 2637",134v,003,"Usquequo domine*","Usquequo domine*","Dom. 1 p. Pent.",MI,InV,,g01122a,5,,
"E-SAu Ms 2637",135r,001,"Ego dixi domine miserere mei sana","Ego dixi domine miserere mei sana animam meam quoniam peccavi tibi","Dom. 1 p. Pent.",MI,Gr,,g01123,5,,
"E-SAu Ms 2637",135r,002,"Beatus qui intelligit uper egenum et","Beatus qui intelligit uper egenum et pauperem in die mala liberabit eum dominus","Dom. 1 p. Pent.",MI,GrV,,g01123a,5,,
"E-SAu Ms 2637",135r,003,"Alleluia Verba mea auribus percipe domine","Alleluia Verba mea auribus percipe domine intellige clamorem meum","Dom. 1 p. Pent.",MI,Al,,g01125,2,,
"E-SAu Ms 2637",135v,001,"Intende voci orationis*","Intende voci orationis*","Dom. 1 p. Pent.",MI,Of,,g00769,,,
"E-SAu Ms 2637",135v,002,"Narrabo omnia*","Narrabo omnia*","Dom. 1 p. Epiph.",MI,Cm,,g02185,,,
"E-SAu Ms 2637",136r,001,"Factus est dominus protector meus et","Factus est dominus protector meus et eduxit me in latitudinem salvum me fecit quoniam voluit me","Dom. 2 p. Pent.",MI,In,,g01133,1,,
"E-SAu Ms 2637",136r,002,"Diligam te*","Diligam te*","Dom. 2 p. Pent.",MI,InV,,g00631a,1,,
"E-SAu Ms 2637",136r,003,"Ad dominum dum tribularer*","Ad dominum dum tribularer*","Dom. 2 p. Pent.",MI,Gr,,g01134,,,
"E-SAu Ms 2637",136r,004,"Alleluia Domine deus meus in te","Alleluia Domine deus meus in te speravi salvum me fac ex omnibus persequentibus me et libera me","Dom. 2 p. Pent.",MI,Al,,g01136,1?,,
"E-SAu Ms 2637",136r-136v,005,"Alleluia Deus judex justus fortis et","Alleluia Deus judex justus fortis et patiens numquid irascetur per singulos dies","Dom. 2 p. Pent.",MI,Al,,g01148,8?,,
"E-SAu Ms 2637",136v,001,"Factus est dominus*","Factus est dominus*","Dom. 2 p. Pent.",MI,Of,,g00798,,,
"E-SAu Ms 2637",136v,002,"Cantabo domino qui bona tribuit mihi","Cantabo domino qui bona tribuit mihi et psallam nomini domini altissimi","Dom. 2 p. Pent.",MI,Cm,,g01138,2,,
"E-SAu Ms 2637",137r,001,"Respice in me et miserere mei","Respice in me et miserere mei domine quoniam unicus et pauper sum ego vide humilitatem meam et laborem meum et dimitte omnia peccata mea deus meus","Dom. 3 p. Pent.",MI,In,,g01145,6,,
"E-SAu Ms 2637",137r,002,"Ad te domine levavi*","Ad te domine levavi*","Dom. 3 p. Pent.",MI,InV,,g02020a.1,6,,
"E-SAu Ms 2637",137v,001,"Jacta cogitatum*","Jacta cogitatum*","Dom. 3 p. Pent.",MI,Gr,,g01146,,,
"E-SAu Ms 2637",137v,002,"Alleluia Diligam te domine virtus mea","Alleluia Diligam te domine virtus mea dominus firmamentum meum et refugium meum et liberator meus","Dom. 3 p. Pent.",MI,Al,,g02186,5,,
"E-SAu Ms 2637",137v,003,"Alleluia Caeli enarrant gloriam dei et","Alleluia Caeli enarrant gloriam dei et opera manuum ejus annuntiat firmamentum","Dom. 3 p. Pent.",MI,Al,,g02188,7,,
"E-SAu Ms 2637",137v,004,"Dies diei eructat verbum et nox","Dies diei eructat verbum et nox nocti indicat scientiam","Dom. 3 p. Pent.",MI,AlV,,g02188a,7,,
"E-SAu Ms 2637",138r,001,"Sperent in te omnes*","Sperent in te omnes*","Dom. 3 p. Pent.",MI,Of,,g01149,,,
"E-SAu Ms 2637",138r,002,"Ego clamavi quoniam exaudisti me deus","Ego clamavi quoniam exaudisti me deus inclina aurem tuam et exaudi verba mea","Dom. 3 p. Pent.",MI,Cm,,g01252,8?,,
"E-SAu Ms 2637",138v,001,"Dominus illuminatio mea et salus mea","Dominus illuminatio mea et salus mea quem timebo dominus defensor vitae meae a quo trepidabo qui tribulant me inimici mei infirmati sunt et ceciderunt","Dom. 4 p. Pent.",MI,In,,g01151,2,,
"E-SAu Ms 2637",138v,002,"Si consistant*","Si consistant*","Dom. 4 p. Pent.",MI,InV,,g01971,2,,
"E-SAu Ms 2637",138v,003,Propitius*,Propitius*,"Dom. 4 p. Pent.",MI,Gr,,g00707,,,
"E-SAu Ms 2637",138v-139r,003,"Alleluia Domine in virtute tua laetabitur","Alleluia Domine in virtute tua laetabitur rex et super salutare tuum exsultabit vehementer","Dom. 4 p. Pent.",MI,Al,,g01156,6,,
"E-SAu Ms 2637",139r,001,"Illumina oculos meos*","Illumina oculos meos*","Dom. 4 p. Pent.",MI,Of,,g01153,,,
"E-SAu Ms 2637",139r,002,"Dominus firmamentum meum et refugium meum","Dominus firmamentum meum et refugium meum et liberator meus deus meus adjutor meus","Dom. 4 p. Pent.",MI,Cm,,g01154,2,,
"E-SAu Ms 2637",139v,001,"Exaudi domine vocem meam qua clamavi","Exaudi domine vocem meam qua clamavi ad te adjutor meus esto ne derelinquas me neque despicias me deus salutaris meus","Dom. 5 p. Pent.",MI,In,,g01155,4,,
"E-SAu Ms 2637",139v,002,"Dominus illuminatio*","Dominus illuminatio*","Dom. 5 p. Pent.",MI,InV,,g00733a.1,4,,
"E-SAu Ms 2637",140r,001,"Protector noster*","Protector noster*","Dom. 6 p. Pent.",MI,Gr,,g00709,,,
"E-SAu Ms 2637",140r,002,"Alleluia In te domine speravi non","Alleluia In te domine speravi non confundar in aeternum in tua justitia libera me et eripe me inclina ad me aurem tuam accelera ut eripias  me","Dom. 5 p. Pent.",MI,Al,,g01159,3,,
"E-SAu Ms 2637",140r,003,"Alleluia Beati quorum remissae sunt iniquitates","Alleluia Beati quorum remissae sunt iniquitates et quorum tecta sunt peccata","Dom. 5 p. Pent.",MI,Al,,g02587,1,,
"E-SAu Ms 2637",140v,001,"Benedicam dominum*","Benedicam dominum*","Dom. 5 p. Pent.",MI,Of,,g00731,,,
"E-SAu Ms 2637",140v,002,"Circuibo et immolabo in tabernaculo ejus","Circuibo et immolabo in tabernaculo ejus hostiam jubilationis cantabo et psalmum dicam Domino","Dom. 5 p. Pent.",MI,Cm,,g01160,6,,
"E-SAu Ms 2637",141r,001,"Dominus fortitudo plebis suae et protector","Dominus fortitudo plebis suae et protector salutarium christi sui est salvum fac populum tuum domine et benedic hereditati tuae et rege eos usque in saeculum","Dom. 6 p. Pent.",MI,In,,g01158,2,,
"E-SAu Ms 2637",141r,002,"Ad te domine*","Ad te domine*","Dom. 6 p. Pent.",MI,InV,,g02020a.1,2,,
"E-SAu Ms 2637",141v,001,"Convertere domine*","Convertere domine*","Dom. 6 p. Pent.",MI,Gr,,g00711,,,
"E-SAu Ms 2637",141v,002,"Alleluia Omnes gentes*","Alleluia Omnes gentes*","Dom. 6 p. Pent.",MI,Al,,008433,,,
"E-SAu Ms 2637",141v,003,"Alleluia Benedicam dominum in omni tempore","Alleluia Benedicam dominum in omni tempore semper laus ejus in ore meo","Dom. 6 p. Pent.",MI,Al,,g02189,1,,
"E-SAu Ms 2637",141v,004,"Perfice gressus meos*","Perfice gressus meos*","Dom. 6 p. Pent.",MI,Of,,g00646,,,
"E-SAu Ms 2637",141v,005,"Unam petii a domino hanc requiram","Unam petii a domino hanc requiram ut inhabitem in domo domini omnibus diebus vitae meae","Dom. 6 p. Pent.",MI,Cm,,g01157,7,,
"E-SAu Ms 2637",142r,001,"Omnes gentes*","Omnes gentes*","Dom. 7 p. Pent.",MI,In,,g01161,,,
"E-SAu Ms 2637",142v,001,"Venite filii audite*","Venite filii audite*","Dom. 7 p. Pent.",MI,Gr,,g01162,,,
"E-SAu Ms 2637",142v,002,"Alleluia Magnus dominus et laudabilis valde","Alleluia Magnus dominus et laudabilis valde in civitate dei in monte sancto ejus","Dom. 7 p. Pent.",MI,Al,,g01170,7,,
"E-SAu Ms 2637",142v,003,"Sicut in holocaustum arietum et taurorum","Sicut in holocaustum arietum et taurorum et sicut in millibus agnorum pinguium sic fiat sacrificium nostrum in conspectu tuo hodie ut placeat tibi quia non est confusio confidentibus in te domine","Dom. 7 p. Pent.",MI,Of,,g01165,5,,
"E-SAu Ms 2637",142v-143r,004,"Et nunc sequimur in toto corde","Et nunc sequimur in toto corde et timemus te et quaerimus faciem tuam domine ne confundas nos sed fac nobis juxta mansuetudinem tuam et secundum multitudinem misericordiae tuae","Dom. 7 p. Pent.",MI,OfV,,g01165a,5,,
"E-SAu Ms 2637",143r,001,"In spiritu humilitatis et in animo","In spiritu humilitatis et in animo contrito suscipiamur domine a te et sic fiat sacrificium nostrum ut ad te suscipiatur hodie et placeat tibi domine deus","Dom. 7 p. Pent.",MI,OfV,,g01165b,5,,
"E-SAu Ms 2637",143r,002,"Inclina aurem tuam accelera ut eruas","Inclina aurem tuam accelera ut eruas nos domine","Dom. 7 p. Pent.",MI,Cm,,g01166,4,,
"E-SAu Ms 2637",143v,001,"Suscepimus deus*","Suscepimus deus*","Dom. 8 p. Pent.",MI,In,,g01167,,,
"E-SAu Ms 2637",143v,002,"Magnus dominus*","Magnus dominus*","Dom. 8 p. Pent.",MI,InV,,g01167a,1,,
"E-SAu Ms 2637",143v,003,ille.,ille.,"Dom. 8 p. Pent.",MI,Gr,,,,,
"E-SAu Ms 2637",143v-144r,004,"Alleluia Exaudi deus orationem meam et","Alleluia Exaudi deus orationem meam et ne disperis deprecationem meam intende in me et exaudi me","Dom. 8 p. Pent.",MI,Al,,g02588,7?,,
"E-SAu Ms 2637",144r,001,"Alleluia Eripe me de inimicis meis","Alleluia Eripe me de inimicis meis deus meus et ab insurgentibus in me libera me","Dom. 8 p. Pent.",MI,Al,,g01176,2,,
"E-SAu Ms 2637",144r,002,"Populum humilem*","Populum humilem*","Dom. 8 p. Pent.",MI,Of,,g01171,,,
"E-SAu Ms 2637",144r,003,"Gustate et videte quoniam suavis est","Gustate et videte quoniam suavis est dominus beatus vir qui sperat in eo","Dom. 8 p. Pent.",MI,Cm,,g01172,3,,
"E-SAu Ms 2637",145r,001,"Ecce deus adjuva me et dominus","Ecce deus adjuva me et dominus susceptor est animae meae averte mala inimicis meis in veritate tua disperde illos protector meus domine","Dom. 9 p. Pent.",MI,In,,g01173,5,,
"E-SAu Ms 2637",145r,002,"Deus in nomine tuo*","Deus in nomine tuo*","Dom. 9 p. Pent.",MI,InV,,g01173a,5,,
"E-SAu Ms 2637",145r,003,"Domine dominus noster quam admirabile est","Domine dominus noster quam admirabile est nomen tuum in universa terra","Dom. 9 p. Pent.",MI,Gr,,g01174,5,,
"E-SAu Ms 2637",145r,004,"Quoniam elevata est magnificentia tua super","Quoniam elevata est magnificentia tua super caelos","Dom. 9 p. Pent.",MI,GrV,,g01174a,5,,
"E-SAu Ms 2637",145v,001,"Alleluia Te decet hymnus deus in","Alleluia Te decet hymnus deus in Sion et tibi reddetur votum in Jerusalem","Dom. 9 p. Pent.",MI,Al,,008440,7,,
"E-SAu Ms 2637",145v,002,"Alleluia Attendite popule meus in legem","Alleluia Attendite popule meus in legem meam","Dom. 9 p. Pent.",MI,Al,,g02191,6,,
"E-SAu Ms 2637",145v,003,"Justiciae domini*","Justiciae domini*","Dom. 9 p. Pent.",MI,Of,,g00752,,,
"E-SAu Ms 2637",145v,004,"Primum quaerite regnum dei et omnia","Primum quaerite regnum dei et omnia adjicientur vobis dicit dominus","Dom. 9 p. Pent.",MI,Cm,,g01205,8,,
"E-SAu Ms 2637",146r,001,"Dum clamarem ad dominum*","Dum clamarem ad dominum*","Dom. 10 p. Pent.",MI,In,,g01178,,,
"E-SAu Ms 2637",146v,001,"Custodi me domine*","Custodi me domine*","Dom. 10 p. Pent.",MI,Gr,,g01179,,,
"E-SAu Ms 2637",146v,002,"Alleluia Deus venerunt gentes in hereditatem","Alleluia Deus venerunt gentes in hereditatem tuam polluerunt templum sanctum tuum posuerunt Jerusalem in pomorum custodiam","Dom. 10 p. Pent.",MI,Al,,g02589,2|1,,
"E-SAu Ms 2637",146v,003,"Alleluia Exsultate deo adjutori nostro jubilate","Alleluia Exsultate deo adjutori nostro jubilate deo Jacob sumite psalmum jucundum cum cithara","Dom. 10 p. Pent.",MI,Al,,g01186,7,,
"E-SAu Ms 2637",146v,004,"Ad te domine levavi*","Ad te domine levavi*","Dom. 10 p. Pent.",MI,Of,,g00493,,,
"E-SAu Ms 2637",146v,005,"Acceptabis sacrificium*","Acceptabis sacrificium*","Dom. 10 p. Pent.",MI,Cm,,g01182,,,
"E-SAu Ms 2637",147v,001,"Deus in loco sancto suo deus","Deus in loco sancto suo deus qui inhabitare facit unanimes in domo ipse dabit virtutem et fortitudinem plebi suae","Dom. 11 p. Pent.",MI,In,,g01183,"5 |7",,
"E-SAu Ms 2637",147v,002,"Exsurgat deus*","Exsurgat deus*","Dom. 11 p. Pent.",MI,InV,,g01183a,7,,
"E-SAu Ms 2637",147v,003,"In deo speravit cor meum*","In deo speravit cor meum*","Dom. 11 p. Pent.",MI,Gr,,g01184,,,
"E-SAu Ms 2637",147v,004,"Ad te domine*","Ad te domine*","Dom. 11 p. Pent.",MI,GrV,,g01184a,,,
"E-SAu Ms 2637",147v,005,"Alleluia Domine deus salutis meae in","Alleluia Domine deus salutis meae in die clamavi et nocte coram te","Dom. 11 p. Pent.",MI,Al,,g01191,3,,
"E-SAu Ms 2637",147v,005,"Alleluia Domine refugium factus es nobis","Alleluia Domine refugium factus es nobis a generatione et progenie","Dom. 11 p. Pent.",MI,Al,,g01197,7,,
"E-SAu Ms 2637",148r,001,"Exaltabo te domine*","Exaltabo te domine*","Dom. 11 p. Pent.",MI,Of,,g00668,,,
"E-SAu Ms 2637",148r,002,"Honora dominum de tua substantia et","Honora dominum de tua substantia et de primitiis frugum tuarum ut impleantur horrea tua saturitate et vino torcularia redundabunt","Dom. 11 p. Pent.",MI,Cm,,g01187,6,,
"E-SAu Ms 2637",148v,001,"Deus in adjutorium meum*","Deus in adjutorium meum*","Dom. 12 p. Pent.",MI,In,,g02026,,,
"E-SAu Ms 2637",148v-149r,002,"Benedicam dominum in omni tempore semper","Benedicam dominum in omni tempore semper laus ejus in ore meo","Dom. 12 p. Pent.",MI,Gr,,g01189,7,,
"E-SAu Ms 2637",149r,001,"In domino laudabitur anima mea audiant","In domino laudabitur anima mea audiant mansueti et laetentur","Dom. 12 p. Pent.",MI,GrV,,g01189a,7,,
"E-SAu Ms 2637",149r,002,"Alleluia Venite exsultemus domino jubilemus deo","Alleluia Venite exsultemus domino jubilemus deo salutari nostro","Dom. 12 p. Pent.",MI,Al,,g01203,7,,
"E-SAu Ms 2637",149r,003,"Praeoccupemus faciem ejus in confessione et","Praeoccupemus faciem ejus in confessione et in psalmis jubilemus ei","Dom. 12 p. Pent.",MI,AlV,,g02133,7,,
"E-SAu Ms 2637",149r,004,"Precatus est Moyses*","Precatus est Moyses*","Dom. 12 p. Pent.",MI,Of,,g01192,,,
"E-SAu Ms 2637",149r,005,"De fructu operum tuorum domine satiabitur","De fructu operum tuorum domine satiabitur terra ut educas panem de terra et vinum laetificet cor hominis ut exhilaret faciem in oleo et panis cor hominis confirmet","Dom. 12 p. Pent.",MI,Cm,,g01193,6,,
"E-SAu Ms 2637",149v,001,"Respice domine in testamentum tuum et","Respice domine in testamentum tuum et animas pauperum tuorum ne derelinquas in finem exsurge domine et judica causam tuam et ne obliviscaris voces quaerentium te","Dom. 13 p. Pent.",MI,In,,g01194,7,,
"E-SAu Ms 2637",149v,002,"Quam dilecta*","Quam dilecta*","Dom. 13 p. Pent.",MI,InV,,g01401c,7,,
"E-SAu Ms 2637",150r,001,"Respice domine*","Respice domine*","Dom. 13 p. Pent.",MI,Gr,,g01195,,,
"E-SAu Ms 2637",150r,002,"Alleluia Quoniam deus magnus dominus et","Alleluia Quoniam deus magnus dominus et rex magnus super omnem terram","Dom. 13 p. Pent.",MI,Al,,507036,7,,
"E-SAu Ms 2637",150r,003,"Alleluia Cantate domino canticum novum quia","Alleluia Cantate domino canticum novum quia mirabilia fecit dominus","Dom. 13 p. Pent.",MI,Al,,008417,1,,
"E-SAu Ms 2637",150v,001,"In te speravi domine*","In te speravi domine*","Dom. 13 p. Pent.",MI,Of,,g01198,,,
"E-SAu Ms 2637",150v,002,"Panem de caelo dedisti nobis domine","Panem de caelo dedisti nobis domine habentem omne delectamentum et omnem saporem suavitatis","Dom. 13 p. Pent.",MI,Cm,,g01199,6,,
"E-SAu Ms 2637",151v,001,"Protector noster aspice deus et respice","Protector noster aspice deus et respice in faciem christi tui quia melior est dies una in atriis tuis super milia","Dom. 14 p. Pent.",MI,In,,g01200,3,,
"E-SAu Ms 2637",151v,002,"Quam dilecta*","Quam dilecta*","Dom. 14 p. Pent.",MI,InV,,g01401c,3,,
"E-SAu Ms 2637",151v,003,"Bonum est confiteri*","Bonum est confiteri*","Dom. 14 p. Pent.",MI,Gr,,g01207,,,
"E-SAu Ms 2637",151v,004,"Alleluia Domine exaudi orationem meam et","Alleluia Domine exaudi orationem meam et clamor meus ad te veniat","Dom. 14 p. Pent.",MI,Al,,g01219,*,,
"E-SAu Ms 2637",151v,005,"Alleluia Timebunt gentes nomen tuum domine","Alleluia Timebunt gentes nomen tuum domine et omnes reges terrae gloriam tuam","Dom. 14 p. Pent.",MI,Al,,507043,4,,
"E-SAu Ms 2637",152r,001,"Immitti angelum*","Immitti angelum*","Dom. 14 p. Pent.",MI,Of,,g01204,,,
"E-SAu Ms 2637",152r,002,"Panis quem ego*","Panis quem ego*","Dom. 14 p. Pent.",MI,Cm,,g01211,,,
"E-SAu Ms 2637",152v,001,"Inclina domine aurem tuam ad me","Inclina domine aurem tuam ad me et exaudi me salvum fac servum tuum deus meus sperantem in te miserere mihi domine quoniam ad te clamavi tota die","Dom. 15 p. Pent.",MI,In,,g01206,1,,
"E-SAu Ms 2637",152v,002,"Laetifica animam* [Laetifica anima mea]","Laetifica animam* [Laetifica anima mea]","Dom. 15 p. Pent.",MI,InV,,g01206c,1,,
"E-SAu Ms 2637",152v,003,"Bonum est confidere*","Bonum est confidere*","Dom. 15 p. Pent.",MI,Gr,,g01201,,,
"E-SAu Ms 2637",152v,004,"Alleluia Confitemini domino et invocate et","Alleluia Confitemini domino et invocate et invocate nomen ejus annuntiate inter gentes opera ejus","Dom. 15 p. Pent.",MI,Al,,g01234,2,,
"E-SAu Ms 2637",152v,005,"Alleluia Paratum cor meum deus paratum","Alleluia Paratum cor meum deus paratum cor meum cantabo et psallam tibi in gloria mea","Dom. 15 p. Pent.",MI,Al,,g01238,3,,
"E-SAu Ms 2637",153r,001,Exspectans*,Exspectans*,"Dom. 15 p. Pent.",MI,Of,,g01210,,,
"E-SAu Ms 2637",153r,002,"Qui manducat*","Qui manducat*","Dom. 15 p. Pent.",MI,Cm,,g01177,,,
"E-SAu Ms 2637",154r,001,"Miserere mihi domine quoniam ad te","Miserere mihi domine quoniam ad te clamavi tota die quia tu domine suavis ac mitis es et copiosus in misericordia omnibus invocantibus te","Dom. 16 p. Pent.",MI,In,,g01212,8,,
"E-SAu Ms 2637",154r,002,"Inclina domine*","Inclina domine*","Dom. 15 p. Pent.",MI,InV,,g00768a,7,,
"E-SAu Ms 2637",154r,003,"Timebunt gentes*","Timebunt gentes*","Dom. 16 p. Pent.",MI,Gr,,g00626,,,
"E-SAu Ms 2637",154r,004,"Alleluia Dixit dominus domino meo sede","Alleluia Dixit dominus domino meo sede a dextris meis","Dom. 16 p. Pent.",MI,Al,,g02193,8,,
"E-SAu Ms 2637",154r,005,"Domine in auxilium*","Domine in auxilium*","Dom. 16 p. Pent.",MI,Of,,g01214,,,
"E-SAu Ms 2637",154r,006,"Domine memorabor*","Domine memorabor*","Dom. 16 p. Pent.",MI,Cm,,g01215,,,
"E-SAu Ms 2637",155r,001,"Justus es domine et rectum judicium","Justus es domine et rectum judicium tuum fac cum servo tuo secundum misericordiam tuam","Dom. 17 p. Pent.",MI,In,,g01216,1,,
"E-SAu Ms 2637",155r,002,"Beati immaculati*","Beati immaculati*","Dom. 17 p. Pent.",MI,InV,,g01216a,1,,
"E-SAu Ms 2637",155r,003,"Beata gens*","Beata gens*","Dom. 17 p. Pent.",MI,Gr,,g01217,,,
"E-SAu Ms 2637",155r,004,"Verbo domini*","Verbo domini*","Dom. 17 p. Pent.",MI,GrV,,g01217a,,,
"E-SAu Ms 2637",155r,005,"Alleluia In exitu Israel ex Aegypto","Alleluia In exitu Israel ex Aegypto domus Jacob de populo barbaro","Dom. 17 p. Pent.",MI,Al,,008427.1,2,,
"E-SAu Ms 2637",155r,006,"Facta est Judea sanctificatio ejus Israel","Facta est Judea sanctificatio ejus Israel potestas ejus Israel regnavit in ea","Dom. 17 p. Pent.",MI,AlV,,008427a,2,,
"E-SAu Ms 2637",155v,001,"Oravi deum meum ego daniel dicens","Oravi deum meum ego daniel dicens exaudi domine preces servi tui illumina faciem tuam super sanctuarium tuum et propitius intende populum istum super quem invocatum est nomen tuum deus","Dom. 17 p. Pent.",MI,Of,,g01220,4,,
"E-SAu Ms 2637",155v,002,"Adhuc me loquentem et orante et","Adhuc me loquentem et orante et narrante peccata mea et delicta populi mei israhel.","Dom. 17 p. Pent.",MI,OfV,,g01220a,4,,
"E-SAu Ms 2637",155v,003,"Audivi vocem dicentem mihi Daniel intellege","Audivi vocem dicentem mihi Daniel intellege verba quae loquor tibi quia ego missus sum ad te","Dom. 17 p. Pent.",MI,OfV,,g01220b.1,4,,
"E-SAu Ms 2637",155v,004,"Nam et Michael venit in adjutorium","Nam et Michael venit in adjutorium meum","Dom. 17 p. Pent.",MI,OfV,,g01220c,4,,
