Source,Folio,Seq,Incipit,Text,Feast,Occasion,Genre,Position,"Cantus ID",Mode,Diff,"Diff db"
"E-SAu Ms 2637",001r,001,"Missus est angelus Gabriel a deo","Missus est angelus Gabriel a deo in civitatem Nazareth ad virginem Mariam desponsatam Joseph et dixit ei spiritus sanctus superveniet in te et virtus altissimi obumbrabit tibi ideoque et quod nascetur ex te sanctum vocabitur filius dei dixit autem Maria ecce ancilla domini fiat mihi secundum verbum tuum alleluia","Ad Processionem",X,A,,003792,8,,
"E-SAu Ms 2637",001r,002,"Venite ascendamus ad montem domini et","Venite ascendamus ad montem domini et docebit nos dominus vias suas et ambulabimus in semitis ejus quia de Sion exibit lex et verbum domini de Jerusalem","In tempore Adventus",X,A,,a00251,?,,
"E-SAu Ms 2637",001r,003,"Ecce nomen domini de longinquo venit","Ecce nomen domini de longinquo venit ardens furor eius et venient cum eo sancti in veste praeclara tunc exurgens Gabriel angelus nuntiavit Mariae dicens spiritus sanctus superveniet in te et virtus altissimi obumbrabit tibi nascetur ex te filius vocabunt eum omnes Emmanuel alleluia","In tempore Adventus",X,A,,a00253,?,,
"E-SAu Ms 2637",001r,004,"Vigilate omnes quia dies domini appropinquat","Vigilate omnes quia dies domini appropinquat de quo prophetae ante pronuntiaverunt dicentes beati qui parati sunt occurrere illi","In tempore Adventus",X,A,,a00254,?,,
"E-SAu Ms 2637",001r,005,"Gregorius praesul meritis et nomine dignus","Gregorius praesul meritis et nomine dignus unde genus ducit summum conscendit honorem renovavit monumenta patrum priorum tunc composuit hunc libellum musicae artis scholae cantorum anni circulo eia paraphonista dic cum psalmista","In tempore Adventus",X,A,,a00255,8,,
"E-SAu Ms 2637",001v,001,"Venite omnes exultemus in conspectu Domini","Venite omnes exultemus in conspectu Domini quia prope est dies in quo natale ejus celebremus et in illa die mundo corde ad altare Domini perveniamus quia promittitur filius virginis per visitationem spiritus sancti o beata infantia per quem generis nostri vita est reparata quia tamquam sponsus de thalamo Mariae Christus processit ex utero o virgo super virgines benedicta sic paries filium ut in virginitate non patiaris detrimentum","In tempore Adventus",X,A,,005354.1,?,,
"E-SAu Ms 2637",002r,001,"Ad te levavi animam meam deus","Ad te levavi animam meam deus meus in te confido non erubescam neque irrideant me inimici mei etenim universi qui te exspectant non confundentur","Adventus, dom. 1",MI,In,,g00489,8,,
"E-SAu Ms 2637",002r,002,"Vias tuas domine *","Vias tuas domine *","Adventus, dom. 1",MI,InV,,g00489a,8,,
"E-SAu Ms 2637",002v,001,"Universi qui te exspectant non confundentur","Universi qui te exspectant non confundentur domine","Adventus, dom. 1",MI,Gr,,g00490,1,,
"E-SAu Ms 2637",002v,002,"Vias tuas domine notas fac mihi","Vias tuas domine notas fac mihi et semitas tuas edoce me","Adventus, dom. 1",MI,GrV,,g00490a,1,,
"E-SAu Ms 2637",002v,003,"Alleluia Ostende nobis domine misericordiam tuam","Alleluia Ostende nobis domine misericordiam tuam et salutare tuum da nobis","Adventus, dom. 1",MI,Al,,507038,8,,
"E-SAu Ms 2637",002v,004,"Alleluia Hosanna filio David benedictus qui","Alleluia Hosanna filio David benedictus qui venit in nomine Domini","Adventus, dom. 1",MI,Al,,g02394,8,,
"E-SAu Ms 2637",002v,005,"Alleluia Ecce virgo concipiet et pariet","Alleluia Ecce virgo concipiet et pariet filium Jesum Christum","Adventus, dom. 1",MI,Al,,g02153,2,,
"E-SAu Ms 2637",002v,006,"Alleluia Spiritus sanctus in te descende","Alleluia Spiritus sanctus in te descende virgo Maria dei genitrix intercede pro nobis","Adventus, dom. 1",MI,Al,,g02333,1,,
"E-SAu Ms 2637",003r,001,"Ad te domine levavi animam meam","Ad te domine levavi animam meam deus meus in te confido non erubescam neque irrideant me inimici mei etenim universi qui te exspectant non confundentur","Adventus, dom. 1",MI,Of,,g00493,2,,
"E-SAu Ms 2637",003r,002,"Dirige me in veritate tua et","Dirige me in veritate tua et doce me quia tu es Deus salutaris meus et te sustinui tota die","Adventus, dom. 1",MI,OfV,,g00493a,2,,
"E-SAu Ms 2637",003r,003,"Respice in me et miserere mei","Respice in me et miserere mei Domine custodi animam meam et eripe me non confundar quoniam invocavi te","Adventus, dom. 1",MI,OfV,,g00493b,2,,
"E-SAu Ms 2637",003r,004,"Dominus dabit benignitatem et terra nostra","Dominus dabit benignitatem et terra nostra dabit fructum suum","Adventus, dom. 1",MI,Cm,,g00494,1,,
"E-SAu Ms 2637",003v,001,"Populus Sion ecce dominus veniet ad","Populus Sion ecce dominus veniet ad salvandas gentes et auditam faciet dominus gloriam vocis suae in laetitia cordis vestri","Adventus, dom. 2",MI,In,,g00495,7,,
"E-SAu Ms 2637",003v,002,"Qui regis Israel *","Qui regis Israel *","Adventus, dom. 2",MI,InV,,g00495a,7,,
"E-SAu Ms 2637",004r,001,"Ex Sion species decoris ejus deus","Ex Sion species decoris ejus deus manifeste veniet","Adventus, dom. 2",MI,Gr,,g00496,5,,
"E-SAu Ms 2637",004r,002,"Congregate illi sanctos ejus qui ordinaverunt","Congregate illi sanctos ejus qui ordinaverunt testamentum ejus super sacrificia","Adventus, dom. 2",MI,GrV,,g00496a,5,,
"E-SAu Ms 2637",004r,003,"Alleluia Laetatus sum in his quae","Alleluia Laetatus sum in his quae dicta sunt mihi in domum Domini ibimus","Adventus, dom. 2",MI,Al,,g00498,1,,
"E-SAu Ms 2637",004r,004,"Stantes erant pedes nostri in atriis","Stantes erant pedes nostri in atriis tuis Jerusalem","Adventus, dom. 2",MI,AlV,,g00498b,,,
"E-SAu Ms 2637",004r,005,"Alleluia virtutes caeli movebuntur et tunc","Alleluia virtutes caeli movebuntur et tunc videbunt filium hominis venientem de caelo in nubibus cum potestate magna et majestate","Adventus, dom. 2",MI,Al,,g02155,7,,
"E-SAu Ms 2637",004r,006,"Deus tu convertens vivificabis nos et","Deus tu convertens vivificabis nos et plebs tua laetabitur in te ostende nobis Domine misericordiam tuam et salutare tuum da nobis","Adventus, dom. 2",MI,Of,,g00499,3,,
"E-SAu Ms 2637",004v,001,"Benedixisti domine terram tuam avertisti captivitatem","Benedixisti domine terram tuam avertisti captivitatem Jacob remisisti iniquitatem plebis tuae","Adventus, dom. 2",MI,OfV,,g00499a,3,,
"E-SAu Ms 2637",004v,002,"Misericordia et veritas obviaverunt sibi veritas","Misericordia et veritas obviaverunt sibi veritas de terra orta est et justitia de caelo prospexit","Adventus, dom. 2",MI,OfV,,g00499b,3,,
"E-SAu Ms 2637",004v,003,"Jerusalem surge et sta in excelso","Jerusalem surge et sta in excelso et vide jucunditatem quae veniet tibi a Deo tuo","Adventus, dom. 2",MI,Cm,,g00500,2,,
"E-SAu Ms 2637",005r,001,"Gaudete in domino semper iterum dico","Gaudete in domino semper iterum dico gaudete modestia vestra nota sit omnibus hominibus dominus prope est nihil solliciti sitis sed in omni oratione petitiones vestrae innotescant apud deum","Adventus, dom. 3",MI,In,,g00501,1,,
"E-SAu Ms 2637",005r,002,"Et pax dei quae exsuperat omnem","Et pax dei quae exsuperat omnem sensum custodiat corda vestra et intelligentias","Adventus, dom. 3",MI,InV,,g00501a,1,,
"E-SAu Ms 2637",005v,001,"Qui sedes domine super cherubim excita","Qui sedes domine super cherubim excita potentiam tuam et veni","Adventus, dom. 3",MI,Gr,,g00502,7,,
"E-SAu Ms 2637",005v,002,"Qui regis Israel intende qui deducis","Qui regis Israel intende qui deducis velut ovem Joseph","Adventus, dom. 3",MI,GrV,,g00502a,7,,
"E-SAu Ms 2637",005v,003,"Alleluia Excita domine potentiam tuam et","Alleluia Excita domine potentiam tuam et veni ut salvos facias nos","Adventus, dom. 3",MI,Al,,g00504,4,,
"E-SAu Ms 2637",005v,004,"Alleluia Rex noster adveniet Christus quem","Alleluia Rex noster adveniet Christus quem Joannes praedicavit agnum esse venturum","Adventus, dom. 3",MI,Al,,g02145,2,,
"E-SAu Ms 2637",005v,005,"Benedixisti domine terram tuam avertisti captivitatem","Benedixisti domine terram tuam avertisti captivitatem Jacob remisisti iniquitatem plebis tuae","Adventus, dom. 3",MI,Of,,g00505,4,,
"E-SAu Ms 2637",006r,001,"Operuisti omnia peccata eorum mitigasti omnem","Operuisti omnia peccata eorum mitigasti omnem iram tuam","Adventus, dom. 3",MI,OfV,,g00505a,3,,
"E-SAu Ms 2637",006r,002,"Ostende nobis domine misericordiam tuam et","Ostende nobis domine misericordiam tuam et salutare tuum da nobis","Adventus, dom. 3",MI,OfV,,g00505b,3,,
"E-SAu Ms 2637",006r,003,"Dicite pusillanimes confortamini et nolite timere","Dicite pusillanimes confortamini et nolite timere ecce Deus noster veniet et salvabit nos","Adventus, dom. 3",MI,Cm,,g00506,7,,
"E-SAu Ms 2637",006r,004,"Rorate caeli desuper et nubes pluant","Rorate caeli desuper et nubes pluant justum aperiatur terra et germinet salvatorem","Adv., hebd. 3, fer. 4 Q.T.",MI,In,,501007,1,,
"E-SAu Ms 2637",006r,005,"Et justitia oriatur simul ego*","Et justitia oriatur simul ego*","Adv., hebd. 3, fer. 4 Q.T.",MI,InV,,501007a,1,,
"E-SAu Ms 2637",006v,001,"Tollite portas principes vestras et elevamini","Tollite portas principes vestras et elevamini portae aeternales et introibit rex gloriae","Adv., hebd. 3, fer. 4 Q.T.",MI,Gr,,g02220,2,,
"E-SAu Ms 2637",006v,002,"Quis ascendet in montem domini aut","Quis ascendet in montem domini aut quis stabit in loco sancto ejus Innocens manibus et mundo corde","Adv., hebd. 3, fer. 4 Q.T.",MI,GrV,,g02220a,2,,
"E-SAu Ms 2637",006v,003,"Prope est dominus omnibus invocantibus eum","Prope est dominus omnibus invocantibus eum omnibus qui invocant eum in veritate","Adv., hebd. 3, fer. 4 Q.T.",MI,Gr,,g00530,5,,
"E-SAu Ms 2637",006v,004,"Laudem domini loquetur os meum et","Laudem domini loquetur os meum et benedicat omnis caro nomen sanctum ejus","Adv., hebd. 3, fer. 4 Q.T.",MI,GrV,,g00530a,5,,
"E-SAu Ms 2637",007r,001,"Confortamini et jam nolite timere ecce","Confortamini et jam nolite timere ecce enim Deus noster retribuet judicium ipse veniet et salvos nos faciet","Adv., hebd. 3, fer. 4 Q.T.",MI,Of,,g00509,4,,
"E-SAu Ms 2637",007r,002,"Tunc aperientur oculi caecorum et aures","Tunc aperientur oculi caecorum et aures surdorum audient tunc ascendent claudus quasi cervus et clara erit lingua mutorum","Adv., hebd. 3, fer. 4 Q.T.",MI,OfV,,g00509a,4,,
"E-SAu Ms 2637",007r,003,"Audite itaque domus David non pusillum","Audite itaque domus David non pusillum vobis certamen praestare hominibus quoniam Dominus praestat certamen propterea dabit vobis Dominus signum ecce virgo in utero accipiet et pariet filium et vocabitur nomen eius Emmanuel","Adv., hebd. 3, fer. 4 Q.T.",MI,OfV,,g00509b,4,,
"E-SAu Ms 2637",007r,004,"Ave Maria gratia plena dominus tecum","Ave Maria gratia plena dominus tecum benedicta tu in mulieribus et benedictus fructus ventris tui","Adv., hebd. 3, fer. 4 Q.T.",MI,Of,,g00533,8,,
"E-SAu Ms 2637",007v,001,"Quomodo in me fiet hoc quae","Quomodo in me fiet hoc quae virum non cognosco spiritus domini superveniet in te et virtus altissimi obumbrabit tibi","Adv., hebd. 3, fer. 4 Q.T.",MI,OfV,,g00533a,8,,
"E-SAu Ms 2637",007v,002,"Ideoque quod nascetur ex te sanctum","Ideoque quod nascetur ex te sanctum vocabitur filius dei","Adv., hebd. 3, fer. 4 Q.T.",MI,OfV,,g00533b,7,,
"E-SAu Ms 2637",007v,003,"Ecce virgo concipiet et pariet filium","Ecce virgo concipiet et pariet filium et vocabitur nomen ejus Emmanuel","Adv., hebd. 3, fer. 4 Q.T.",MI,Cm,,503007,1,,
"E-SAu Ms 2637",007v,004,"Prope esto Domine et omnes viae","Prope esto Domine et omnes viae tuae veritas initio cognovi de testimoniis tuis quia in aeternum tu es","Adv., hebd. 3, fer. 6 Q.T.",MI,In,,g00510.1,4,,
"E-SAu Ms 2637",007v,005,"Beati immaculati in via qui ambulant","Beati immaculati in via qui ambulant in lege domini","Adv., hebd. 3, fer. 6 Q.T.",MI,InV,,g00510a,4,,
"E-SAu Ms 2637",007v,006,"Ostende nobis Domine misericordiam tuam et","Ostende nobis Domine misericordiam tuam et salutare tuum da nobis","Adv., hebd. 3, fer. 6 Q.T.",MI,Gr,,g00511,2,,
"E-SAu Ms 2637",007v,007,"Benedixisti Domine terram tuam avertisti captivitatem","Benedixisti Domine terram tuam avertisti captivitatem Jacob","Adv., hebd. 3, fer. 6 Q.T.",MI,GrV,,g00511a,2,,
"E-SAu Ms 2637",008r,001,"Deus tu convertens *","Deus tu convertens *","Adv., hebd. 3, fer. 6 Q.T.",MI,Of,,g00499,*,,
"E-SAu Ms 2637",008r,002,"Ecce Dominus veniet et omnes sancti","Ecce Dominus veniet et omnes sancti ejus cum eo et erit in die illa lux magna","Adv., hebd. 3, fer. 6 Q.T.",MI,Cm,,g00513,6,,
"E-SAu Ms 2637",008r,003,"Veni et ostende nobis faciem tuam","Veni et ostende nobis faciem tuam Domine qui sedes super Cherubim et salvi erimus","Adv., hebd. 3, sabbato Q.T.",MI,In,,g00514,2,,
"E-SAu Ms 2637",008r,004,"Qui regis Israel intende qui deducis","Qui regis Israel intende qui deducis velut ovem Joseph","Adv., hebd. 3, sabbato Q.T.",MI,InV,,g00514a,2,,
"E-SAu Ms 2637",008r,005,"A summo caelo egressio ejus et","A summo caelo egressio ejus et occursus ejus usque ad summum ejus","Adv., hebd. 3, sabbato Q.T.",MI,Gr,,g00515,2,,
"E-SAu Ms 2637",008r,006,"Caeli enarrant gloriam dei et opera","Caeli enarrant gloriam dei et opera manuum ejus annuntiat firmamentum","Adv., hebd. 3, sabbato Q.T.",MI,GrV,,g00515a,2,,
"E-SAu Ms 2637",008v,001,"In sole posuit tabernaculum suum et","In sole posuit tabernaculum suum et ipse tamquam sponsus procedens de thalamo suo","Adv., hebd. 3, sabbato Q.T.",MI,Gr,,g00517,2,,
"E-SAu Ms 2637",008v,002,"A summo caelo egressio ejus et","A summo caelo egressio ejus et occursus ejus usque ad summum ejus","Adv., hebd. 3, sabbato Q.T.",MI,GrV,,g00517a,2,,
"E-SAu Ms 2637",008v,003,"Domine Deus virtutum converte nos et","Domine Deus virtutum converte nos et ostende faciem tuam et salvi erimus","Adv., hebd. 3, sabbato Q.T.",MI,Gr,,g00519,2,,
"E-SAu Ms 2637",008v,004,"Excita Domine potentiam tuam et veni","Excita Domine potentiam tuam et veni ut salvos facias nos","Adv., hebd. 3, sabbato Q.T.",MI,GrV,,g00519a,2,,
"E-SAu Ms 2637",009r,001,"Excita Domine potentiam tuam et veni","Excita Domine potentiam tuam et veni ut salvos facias nos","Adv., hebd. 3, sabbato Q.T.",MI,Gr,,g00521,2,,
"E-SAu Ms 2637",009r,002,"Qui regis Israel intende qui deducis","Qui regis Israel intende qui deducis velut ovem Joseph qui sedes super Cherubim appare coram Ephraim Benjamin et Manasse","Adv., hebd. 3, sabbato Q.T.",MI,GrV,,g00521a,2,,
"E-SAu Ms 2637",009v,001,"Benedictus es Domine Deus patrum nostrorum","Benedictus es Domine Deus patrum nostrorum Et laudabilis et gloriosus in saecula Et benedictum nomen gloriae tuae quod est sanctum Et laudabile et gloriosum in saecula Benedictus es in templo sancto gloriae tuae Et laudabilis et gloriosus in saecula Benedictus es super thronum sanctum regni tui Et laudabilis et gloriosus in saecula Benedictus es super sceptrum divinitatis tuae Et laudabilis et gloriosus in saecula Benedictus es qui sedes super Cherubim intuens abyssos Et laudabilis et gloriosus in saecula Benedictus es qui ambulas super pennas ventorum et super undas maris Et laudabilis et gloriosus in saecula Benedicant te omnes Angeli et Sancti tui Et laudent te et glorificent in saecula Benedicant te caeli terra mare et omnia quae in eis sunt Et laudent te et glorificent in saecula Gloria Patri et Filio et Spiritui Sancto Sicut erat in principio et nunc et semper et in saecula saeculorum Amen","Adv., hebd. 3, sabbato Q.T.",MI,H,,g00523,7,,
"E-SAu Ms 2637",009v,002,"Qui regis Israel intende qui deducis","Qui regis Israel intende qui deducis velut ovem Joseph","Adv., hebd. 3, sabbato Q.T.",MI,Tc,,g00524,8,,
"E-SAu Ms 2637",009v,003,"Qui sedes super Cherubim appare coram","Qui sedes super Cherubim appare coram Ephraim","Adv., hebd. 3, sabbato Q.T.",MI,TcV,,g00524a.1,8,,
"E-SAu Ms 2637",010r,001,"Benjamin et Manasse","Benjamin et Manasse",,MI,TcV,,g00524a.2,,,
"E-SAu Ms 2637",010r,002,"Excita Domine potentiam tuam et veni","Excita Domine potentiam tuam et veni ut salvos facias nos",,MI,TcV,,g00524b,8,,
"E-SAu Ms 2637",010r,003,"Exsulta satis filia Sion praedica filia","Exsulta satis filia Sion praedica filia Jerusalem ecce Rex tuus venit tibi sanctus et salvator","Adv., hebd. 3, sabbato Q.T.",MI,Of,,g00527,3,,
"E-SAu Ms 2637",010r,004,"Loquetur pacem gentibus et potestas ejus","Loquetur pacem gentibus et potestas ejus a mari usque ad mare et a flumine usque ad terminus orbis terrae","Adv., hebd. 3, sabbato Q.T.",MI,OfV,,g00527a,3,,
"E-SAu Ms 2637",010r,005,"Quia ecce venio et habitabo in","Quia ecce venio et habitabo in medio tui dicit dominus omnipotens et confugient ad te in illa die omnes gentes et erunt tibi in plebem","Adv., hebd. 3, sabbato Q.T.",MI,OfV,,g00527b,3,,
"E-SAu Ms 2637",010r,006,"Exsultavit ut gigas ad currendam viam","Exsultavit ut gigas ad currendam viam a summo caelo egressio ejus et occursus ejus usque ad summum ejus","Adv., hebd. 3, sabbato Q.T.",MI,Cm,,g00528,6,,
"E-SAu Ms 2637",010v,001,"Memento nostri Domine in beneplacito populi","Memento nostri Domine in beneplacito populi tui visita nos in salutari tuo ad videndum in bonitate electorum tuorum in laetitia gentis tuae ut lauderis cum haereditate tua","Adventus, dom. 4",MI,In,,g02156,1,,
"E-SAu Ms 2637",010v,002,"Confitemini Domino *","Confitemini Domino *","Adventus, dom. 4",MI,InV,,g01992,1,,
"E-SAu Ms 2637",010v,003,"Prope est Dominus *","Prope est Dominus *","Adventus, dom. 4",MI,Gr,,g00530,*,,
"E-SAu Ms 2637",010v,004,"Laudem *","Laudem *","Adventus, dom. 4",MI,GrV,,g00530a,*,,
"E-SAu Ms 2637",010v,005,"Alleluia Rex noster*","Alleluia Rex noster*","Adventus, dom. 4",MI,AV,,g02145,*,,
"E-SAu Ms 2637",010v,006,"Alleluia Veni Domine et noli tardare","Alleluia Veni Domine et noli tardare relaxa facinora plebis tuae","Adventus, dom. 4",MI,Al,,g00532,3,,
"E-SAu Ms 2637",010v,007,"Ave Maria *","Ave Maria *","Adventus, dom. 4",MI,Of,,g00533,*,,
"E-SAu Ms 2637",010v,008,"Ecce virgo concipiet et pariet *","Ecce virgo concipiet et pariet *","Adventus, dom. 4",MI,Cm,,503007,*,,
"E-SAu Ms 2637",010v,009,"Hodie scietis quia veniet Dominus et","Hodie scietis quia veniet Dominus et salvabit nos et mane videbitis gloriam ejus","Nativitas Domini, vig.",MI,In,,g00535,6,,
"E-SAu Ms 2637",011r,001,"Domini est terra *","Domini est terra *","Nativitas Domini, vig.",MI,InV,,g00535a,6,,
"E-SAu Ms 2637",011r,002,"Hodie scietis quia veniet Dominus et","Hodie scietis quia veniet Dominus et salvabit nos et mane videbitis gloriam ejus","Nativitas Domini, vig.",MI,Gr,,g00536,2,,
"E-SAu Ms 2637",011r,003,"Qui regis Israel intende qui deducis","Qui regis Israel intende qui deducis velut ovem Joseph qui sedes super Cherubim appare coram Ephraim Benjamin et Manasse","Nativitas Domini, vig.",MI,GrV,,g00521a,2,,
"E-SAu Ms 2637",011r,004,"Alleluia Hodie scietis quia veniet Dominus","Alleluia Hodie scietis quia veniet Dominus et mane videbitis gloriam eius","Nativitas Domini, vig.",MI,Al,,g02398,8,,
"E-SAu Ms 2637",011v,001,"Tollite portas principes vestras et elevamini","Tollite portas principes vestras et elevamini portae aeternales et introibit Rex gloriae","Nativitas Domini, vig.",MI,Of,,g00539,2,,
"E-SAu Ms 2637",011v,002,"Domini est terra et plenitudo ejus","Domini est terra et plenitudo ejus orbis terrarum et universi qui habitant in eo","Nativitas Domini, vig.",MI,OfV,,g00539a,2,,
"E-SAu Ms 2637",011v,003,"Ipse super maria fundavit eumet super","Ipse super maria fundavit eumet super flumina praeparavit eum","Nativitas Domini, vig.",MI,OfV,,g00539c,2,,
"E-SAu Ms 2637",011v,004,"Revelabitur gloria domini et videbit omnis","Revelabitur gloria domini et videbit omnis caro salutare dei nostri","Nativitas Domini, vig.",MI,Cm,,g00540,1,,
"E-SAu Ms 2637",011v,005,"Dominus dixit ad me Filius meus","Dominus dixit ad me Filius meus es tu ego hodie genui te","Nativitas Domini",MI,In,,g00541,2,,
"E-SAu Ms 2637",011v,006,"Quare fremuerunt gentes *","Quare fremuerunt gentes *","Nativitas Domini",MI,InV,,g00541a,2,,
"E-SAu Ms 2637",011v-012r,007,"Laudes deo dicam per saecula","Laudes deo dicam per saecula","Nativitas Domini",MI,L,,g02832.Tp1,,,
"E-SAu Ms 2637",012v,001,"Tecum principium in die virtutis tuae","Tecum principium in die virtutis tuae in splendoribus sanctorum et utero ante luciferum genui te","Nativitas Domini",MI,Gr,,g00542,2,,
"E-SAu Ms 2637",012v,002,"Dixit Dominus Domino meo sede a","Dixit Dominus Domino meo sede a dextris meis donec ponam inimicos tuos scabellum pedum tuorum","Nativitas Domini",MI,GrV,,g00542a,2,,
"E-SAu Ms 2637",012v,003,"Alleluia Dominus dixit ad me Filius","Alleluia Dominus dixit ad me Filius meus es tu ego hodie genui te","Nativitas Domini",MI,Al,,g00544,8,,
"E-SAu Ms 2637",013r,001,"Laetentur caeli et exsultet terra ante","Laetentur caeli et exsultet terra ante faciem Domini quoniam venit","Nativitas Domini",MI,Of,,g00545,4,,
"E-SAu Ms 2637",013r,002,"Cantate Domino canticum novum cantate Domino","Cantate Domino canticum novum cantate Domino omnis terra","Nativitas Domini",MI,OfV,,g00545a,4,,
"E-SAu Ms 2637",013r,003,"Cantate Domino benedicite nomen ejus bene","Cantate Domino benedicite nomen ejus bene nuntiate de die in diem salutare ejus","Nativitas Domini",MI,OfV,,g00545b,4,,
"E-SAu Ms 2637",013r,004,"In splendoribus sanctorum ex utero ante","In splendoribus sanctorum ex utero ante luciferum genui te","Nativitas Domini",MI,Cm,,g00546,6,,
"E-SAu Ms 2637",013r,005,"Lux fulgebit hodie super nos quia","Lux fulgebit hodie super nos quia natus est nobis dominus et vocabitur admirabilis deus princeps pacis pater futuri saeculi cujus regni non erit finis","Nativitas Domini",MI,In,,g00547,8,,
"E-SAu Ms 2637",013r,006,"Dominus regnavit *","Dominus regnavit *","Nativitas Domini",MI,InV,,g00547b,8,,
"E-SAu Ms 2637",013v,001,"Benedictus qui venit in nomine Domini","Benedictus qui venit in nomine Domini Deus Dominus et illuxit nobis","Nativitas Domini",MI,Gr,,g00548,5,,
"E-SAu Ms 2637",013v,002,"A Domino factum est et est","A Domino factum est et est mirabile in oculis nostris","Nativitas Domini",MI,GrV,,g00548a,5,,
"E-SAu Ms 2637",013v,003,"Alleluia Dominus regnavit decorem induit induit","Alleluia Dominus regnavit decorem induit induit Dominus fortitudinem et praecinxit se virtute","Nativitas Domini",MI,Al,,g00550,2,,
"E-SAu Ms 2637",013v,004,"Deus enim firmavit orbem terrae qui","Deus enim firmavit orbem terrae qui non commovebitur parata sedes tua Deus ex tunc a saeculo tu es","Nativitas Domini",MI,Of,,g00551,8,,
"E-SAu Ms 2637",013v,005,"Dominus regnavit decorem induit induit Dominus","Dominus regnavit decorem induit induit Dominus fortitudinem et praecinxit se virtute","Nativitas Domini",MI,OfV,,g00551a,8,,
"E-SAu Ms 2637",013v,006,"Mirabilis in excelsis Dominus testimonia tua","Mirabilis in excelsis Dominus testimonia tua credibilia facta sunt nimis domum tuam decet sancta Domine in longitudinem dierum
 
Mirabilis in excelsis Dominus testimonia tua credibilia facta sunt nimis domum tuam decet sancta Domine in longitudinem dierum.","Nativitas Domini",MI,OfV,,g00551b,8,,
"E-SAu Ms 2637",014r,001,"Exsulta filia Sion lauda filia Jerusalem","Exsulta filia Sion lauda filia Jerusalem ecce rex tuus venit sanctus et salvator mundi","Nativitas Domini",MI,Cm,,g00552,4,,
"E-SAu Ms 2637",014r,002,"O quam casta mater et virgo","O quam casta mater et virgo fecunda Maria quae nullam novit maculam Deum portare meruit","Ad Processionem",X,A,,a00229,,,
"E-SAu Ms 2637",014r,003,"O quam casta mater quae sine","O quam casta mater quae sine ulla contaminatione  concepit sine dolore genuit salvatorem","Ad Processionem",X,A,,a00230,,,
"E-SAu Ms 2637",014r,004,"O beatum ventrem Mariae quae tantum","O beatum ventrem Mariae quae tantum nobilem terrae protulit ut diceret chorus caelestium gloria in excelsis deo et in terra pax","Ad Processionem",X,A,,004004,,,
"E-SAu Ms 2637",014r,005,"O beata infantia per quam nostri","O beata infantia per quam nostri generis reparata est vita o gratissimi delectabilesque vagitus per quos aeternos ploratus evasimus o felices panni quibus peccatorum sordes extersimus o praesepe splendidum in quo non solum jacuit foenum animalium sed cibus inventus est angelorum alleluia","Ad Processionem",X,A,,003994,,,
"E-SAu Ms 2637",014r,006,"O Maria Jesse virga caeli regina","O Maria Jesse virga caeli regina maris stella plenitudo temporis ecce jam venit jam olim promissum florem protulisti ergo precamur o domina ut qui te meruimus confiteri Christi matrem sentiamus te piam et singulari merito hunc nobis tu facias placabilem dies istos tuae sanctae virginitatis partu dicatos bene nobis ipse propter te o benignissima disponat quo temporalis sollemnitas nos ad aeternam enutriat laetitiam alleluia","Ad Processionem",X,A,,a00231,,,
"E-SAu Ms 2637",014v,001,"Laetare virgo Maria de qua flos","Laetare virgo Maria de qua flos pulcher procedit qui odore replet caelos fructu qui pascet angelos cujus nobis lux fulget talem nec antea caelum genuit nec postera parturivit habes ergo quo laeteris de te Christus natus est creator astrorum exspectatio gentium alleluia","Ad Processionem",X,A,,003565,,,
"E-SAu Ms 2637",014v,002,"Puer natus est nobis et filius","Puer natus est nobis et filius datus est nobis cujus imperium super humerum ejus et vocabitur nomen ejus magni consilii Angelus","Nativitas Domini",MI,In,,g00553,7,,
"E-SAu Ms 2637",014v,003,"Cantate Domino canticum novum *","Cantate Domino canticum novum *","Nativitas Domini",MI,InV,,g00553a.1,7,,
"E-SAu Ms 2637",015r,001,"Viderunt omnes fines terrae salutare Dei","Viderunt omnes fines terrae salutare Dei nostri jubilate Deo omnis terra","Nativitas Domini",MI,Gr,,g00554,5,,
"E-SAu Ms 2637",015r,002,"Notum fecit Dominus salutare suum ante","Notum fecit Dominus salutare suum ante conspectum gentium revelavit justitiam suam","Nativitas Domini",MI,GrV,,g00554a,5,,
"E-SAu Ms 2637",015r,003,"Alleluia Dies sanctificatus illuxit nobis venite","Alleluia Dies sanctificatus illuxit nobis venite gentes adorate Dominum quia hodie descendit lux magna super terram","Nativitas Domini",MI,Al,,g00556,2,,
"E-SAu Ms 2637",015r,004,"Alleluia Multifarie olim Deus loquens in","Alleluia Multifarie olim Deus loquens in prophetis novissime diebus istis locutus est nobis in Filio suo","Nativitas Domini",MI,Al,,g00585,7,,
